{
  "schemaVersion": 1,
  "source": "coverage-and-drift.json",
  "expectedTypedTotal": 4322,
  "blockedExportCount": 0,
  "familyCount": 11,
  "families": [
    {
      "id": "camera-input-mapper",
      "label": "Camera input mapper",
      "count": 0,
      "expectedCount": 0,
      "exports": []
    },
    {
      "id": "core-utility-types",
      "label": "Core utility types",
      "count": 0,
      "expectedCount": 0,
      "exports": []
    },
    {
      "id": "device-input",
      "label": "Device input",
      "count": 0,
      "expectedCount": 0,
      "exports": []
    },
    {
      "id": "flow-graph",
      "label": "FlowGraph",
      "count": 0,
      "expectedCount": 0,
      "exports": []
    },
    {
      "id": "material-mixins",
      "label": "Material mixins",
      "count": 0,
      "expectedCount": 0,
      "exports": []
    },
    {
      "id": "math-vector-tensor",
      "label": "Math/vector/tensor",
      "count": 0,
      "expectedCount": 0,
      "exports": []
    },
    {
      "id": "misc-higher-order-functions",
      "label": "Miscellaneous higher-order functions",
      "count": 0,
      "expectedCount": 0,
      "exports": []
    },
    {
      "id": "physics",
      "label": "Physics",
      "count": 0,
      "expectedCount": 0,
      "exports": []
    },
    {
      "id": "typed-array-factory",
      "label": "Typed-array factory",
      "count": 0,
      "expectedCount": 0,
      "exports": []
    },
    {
      "id": "xr-vr",
      "label": "XR and VR",
      "count": 0,
      "expectedCount": 0,
      "exports": []
    },
    {
      "id": "gltf-loaders",
      "label": "glTF loaders",
      "count": 0,
      "expectedCount": 0,
      "exports": []
    }
  ]
}
